{
  "decision_id": "FDC-20260322-180000",
  "snapshot_dt": "2026-03-22T18:00:00+09:00",
  "artifact_version": "v1.0",
  "plan_id": "COP-20260322-180000",
  "fallback_used": false,
  "decisions": [
    {
      "ticker": "005930",
      "name": "삼성전자",
      "action": "buy",
      "weight": 15.0,
      "decision": "approve",
      "veto_reason": null,
      "evidence_ids": ["NEWS-20260322-001", "DART-20260315-005930"]
    },
    {
      "ticker": "000660",
      "name": "SK하이닉스",
      "action": "buy",
      "weight": 12.0,
      "decision": "approve",
      "veto_reason": null,
      "evidence_ids": ["NEWS-20260322-SECTOR-001"]
    },
    {
      "ticker": "005380",
      "name": "현대차",
      "action": "buy",
      "weight": 8.0,
      "decision": "veto",
      "veto_reason": "Quant는 buy 신호(0.61)이나, 미국 관세 리스크 뉴스(NEWS-20260322-002)와 confidence 0.48이 낮은 비중 대비 불안정. 관세 확정 전까지 보류 권고.",
      "evidence_ids": ["NEWS-20260322-002"]
    }
  ],
  "conflicts": [
    {
      "ticker": "005380",
      "conflict_type": "signal_disagreement",
      "description": "Quant(buy, 0.61) vs News(sell, 미국 관세 리스크)",
      "resolution": "News 측 악재가 단기 실현 가능성이 높아 veto 판단"
    }
  ],
  "execution_summary": {
    "approved_count": 2,
    "vetoed_count": 1,
    "total_exposure": 27.0,
    "cash_ratio": 73.0,
    "explanation": "금일 시장은 green regime으로 정상 투자 가능 상태입니다. 삼성전자와 SK하이닉스는 반도체 업황 개선 기대감에 approve 하였으나, 현대차는 미국 관세 리스크 불확실성으로 veto 하였습니다. 포트폴리오 총 노출은 27%이며, W1 초기 단계로 보수적 운용을 유지합니다."
  }
}
