{
  "decision_id": "FDC-20260325-180000",
  "snapshot_dt": "2026-03-25T18:00:00+09:00",
  "artifact_version": "v1.0",
  "plan_id": "COP-20260325-180000",
  "fallback_used": true,
  "decisions": [
    {
      "ticker": "051910",
      "name": "LG화학",
      "action": "buy",
      "weight": 20.0,
      "decision": "approve",
      "veto_reason": null,
      "evidence_ids": [
        "MOCK-051910"
      ],
      "uncertainty_score": 0.1698
    },
    {
      "ticker": "009150",
      "name": "삼성전기",
      "action": "buy",
      "weight": 20.0,
      "decision": "approve",
      "veto_reason": null,
      "evidence_ids": [
        "MOCK-009150"
      ],
      "uncertainty_score": 0.2494
    },
    {
      "ticker": "005380",
      "name": "현대차",
      "action": "buy",
      "weight": 20.0,
      "decision": "veto",
      "veto_reason": "confidence(0.37) < FDA 임계값(0.4)이고 비중(20.0%) > 10%로 리스크 과다",
      "evidence_ids": [
        "MOCK-005380"
      ],
      "uncertainty_score": 0.3118
    }
  ],
  "conflicts": [],
  "execution_summary": {
    "approved_count": 2,
    "vetoed_count": 1,
    "total_exposure": 40.0,
    "cash_ratio": 60.0,
    "explanation": "이번 투자 결정에서는 시장 상황이 'green' regime으로, 비교적 긍정적인 시장 환경을 나타내고 있습니다. 총 노출은 40%로 제한되어 있으며, 60%의 현금을 보유하고 있어 추가적인 시장 변동성에 대비할 수 있는 여력이 있습니다. \n\nLG화학과 삼성전기는 각각 20%의 비중으로 승인되었습니다. 이는 두 종목 모두 시장 상황에 맞춰 긍정적인 신호를 보이고 있으며, 포트폴리오 내에서의 적절한 비중을 차지하고 있기 때문입니다. 반면, 현대차의 경우 confidence 수준이 0.37로 FDA의 임계값인 0.4에 미치지 못하고, 제안된 비중이 20%로 다소 높아 리스크가 크다고 판단되어 거부되었습니다. 이는 포트폴리오의 안정성을 유지하기 위한 결정입니다."
  }
}