{
  "decision_id": "FDC-20260325-180000",
  "snapshot_dt": "2026-03-25T18:00:00+09:00",
  "artifact_version": "v1.0",
  "plan_id": "COP-20260325-180000",
  "fallback_used": true,
  "decisions": [
    {
      "ticker": "051910",
      "name": "LG화학",
      "action": "buy",
      "weight": 10.0,
      "decision": "approve",
      "veto_reason": null,
      "evidence_ids": [
        "MOCK-051910"
      ],
      "uncertainty_score": 0.1698
    },
    {
      "ticker": "009150",
      "name": "삼성전기",
      "action": "buy",
      "weight": 10.0,
      "decision": "approve",
      "veto_reason": null,
      "evidence_ids": [
        "MOCK-009150"
      ],
      "uncertainty_score": 0.2494
    },
    {
      "ticker": "005380",
      "name": "현대차",
      "action": "buy",
      "weight": 10.0,
      "decision": "approve",
      "veto_reason": null,
      "evidence_ids": [
        "MOCK-005380"
      ],
      "uncertainty_score": 0.3118
    }
  ],
  "conflicts": [],
  "execution_summary": {
    "approved_count": 3,
    "vetoed_count": 0,
    "total_exposure": 30.0,
    "cash_ratio": 70.0,
    "explanation": "이번 투자 결정은 시장의 \"yellow\" 레짐 상태를 고려하여 이루어졌습니다. 이는 시장의 변동성이 중간 정도이며, 신중한 접근이 필요함을 의미합니다. 총 노출 30%로 제한하여 포트폴리오의 안정성을 유지하면서도, LG화학, 삼성전기, 현대차 각각에 10%씩 투자하여 분산 투자를 통해 리스크를 관리하고자 했습니다. 이러한 결정은 각 기업의 현재 시장 위치와 성장 가능성을 긍정적으로 평가한 결과입니다."
  }
}